,title,date,url,content
158,조국 아들 허위 인턴확인서…최강욱 주장 '조목조목' 논박한 1심 판사,2021. 01. 31,http://news.khan.co.kr/kh_news/khan_art_view.html?artid=202101311921001&code=940100,지난 28일 국회의원인 최강욱 열린민주당 대표는 조국 전 법무부 장관의 아들에게 허위 인턴 확인서를 발급해준 혐의로 징역 8개월에 집행유예 2년을 선고받았다 서울중앙지법 형사9단독 정종건 판사는 조 전 장관의 아들 조씨가 2017년 1월10일부터 같은 해 10월11일까지 매주 2회 총 16시간 동안 최 대표가 속한 법무법인 청맥에서 인턴 활동을 했다는 최 대표의 확인서는 허위라고 판단했다 최 대표는 선고 후 판사는 조씨가 한 사무실에서의 활동 사실을 인정하고도 유죄로 판단했다 며 재판부의 인식과 판단에 매우 유감 이라고 반응했다 판결문 속으로 들어가 보자 인턴 활동기간 16시간 매주인가 총누적인가최 대표의 주장을 살펴보면 조씨가 한 인턴 활동은 체험형 인턴이었다 정기적으로 출근하는 채용 연계형 인턴과 다르다는 의미다 조씨가 1주일에 1 2차례 자신의 사무실로 와 업무를 곁에서 보고 배우며 자신이 지시하는 간단한 업무를 수행하는 방법으로 인턴 활동이 이뤄졌다고 주장했다 주로 저녁 6시 이후나 주말 2 4시간 정도 이뤄졌으며 누적 활동시간이 2017년 10월11일까지 총 16시간 정도였다고 주장했다 정 판사는 2017년 1월10일부터 같은 해 10월11일까지 매주 2회 총 16시간 동안 이라는 기간에 대한 의미를 판단했다 정 판사는 9개월 동안 매주 2회 인턴활동의 총 누적합계를 16시간이라고 한다면 매회 활동시간의 평균이 약 12분 정도에 불과하다 고 밝혔다 정 판사는 법무법인 사무실을 포함한 어느 기관에서든 단지 12분 동안 머무르며 수행할 수 있는 역할이 있다고 보기 어렵다 고 판시했다 최 대표 변호인은 재판 과정 중 조씨가 한 번 오면 인턴을 수행하는 시간이 2 4시간인 바 인턴 수행한 횟수를 계산하면 약 4 8회 이라고 주장하기도 했다 이에 정 판사는 이는 인턴 확인서의 다른 부분 9개월 동안 매주 2회 과 전혀 부합하지 않는다 며 결국 총 16시간 을 9개월 동안의 누적 활동시간으로 본다면 확인서의 다른 부분과 조화롭게 해설될 수 없다 고 했다 정 판사는 완화된 의미의 인턴이더라도 정기적으로 출석해 상당한 시간 근무하는 것이 통상적인 모습인 점 일반근로자의 1일 근로시간은 통상 8시간인 점 더군다나 입시에서 경력으로 내세울 목적으로 제출되는 점 등에 비추어 총 16시간 이 증명하는 것은 매주의 누적활동시간이라고 봄이 자연스럽다 고 했다 이 판단을 풀어보면 최 대표 주장대로 인턴 활동 시간을 계산할 경우 실제 활동이 불가능한 1회 평균 12분 이 나오기 때문에 인턴확인서가 의미하는 매주 2회 총 16시간 은 곧 1주당 16시간 즉 매회 8시간 의미로 작성됐다는 것이다 대학원 입시에 필요한 경력으로 삼기에도 후자가 더 자연스럽다는 해석이다 1주일에 2번 정도 사무실에 가 한 번 가면 2 4시간 가량 활동했다 고 한 조씨의 검찰 진술과 차이는 있지만 그나마 매주 활동 시간으로 해석해야 자연스럽다는 판단이다 최 대표와 함께 근무하는 남모 변호사는 재판에서 2017년 초순경 다른 직원들이 퇴근한 저녁 시간인 저녁 7 8시 정도에 조씨로 생각되는 사람을 2번 본 적이 있다 고 했다 법원은 일주일에 4일 야근 주말 이틀 중 하루는 근무하는 남 변호사가 정기적으로 인턴 활동을 했다는 조씨를 겨우 2번 본 적 있다고 말한 점에 주목했다 그가 본 인물이 조씨가 맞다고 해도 실제 인턴 활동을 했다고 보기는 어렵다는 뜻이다 최 대표가 조 전 장관의 아내 정경심 전 동양대 교수에게 보낸 문자메세지도 조씨가 실제 인턴 활동을 하지 않았다는 판단 근거가 됐다 최 대표는 2017년 5월12일 정 전 교수에게 문자를 보내 오랜만에 조씨의 목소리를 들었다 는 내용이 포함된 문자메세지를 보냈다 인턴 확인서에 따르면 당시 5개월째 매주 꾸준히 근무해 왔을 텐데 오랜만에 목소리를 들었다 는 건 앞뒤가 맞지 않는다는 것이다 정 판사는 2017년 1월10일부터 2017년 10월11일 사이에 저녁 6시 이후 또는 휴일 시간에 피고인의 사무실에 몇 차례 들러 영문 번역이나 그 밖의 불상의 업무를 수행했다 는 것에 불과하다 고 했다 정 판사는 이런 활동 사실이 인턴 확인서 내용과 일치하지 않을 뿐만 아니라 9개월 동안 정기적인 업무수행 자체가 없었다는 것으로 볼 수 있다고 했다 인턴확인서 중요서류인가 아닌가최 대표는 이 인턴확인서가 고려대 연세대 정치외교학과 대학원 입학지원시 필수 제출 서류가 아니라며 업무방해를 초래할 정도의 의미가 있는 서류가 아니라고 주장했다 법원도 이 인턴확인서가 대학원 필수제출 서류가 아니라는 점은 인정했다 그러나 이 확인서는 필수제출 서류가 아닐 뿐 조씨의 입학지원 과정에서 중요한 역할을 하는 서류였다 조씨는 두 대학원의 필수제출서류인 대학원 입학지원서의 경력란에 최 대표의 법무법인에 인턴으로 일하고 있다는 취지로 기재했다 또 연세대 대학원 필수제출서류인 학업 및 연구계획서 에도 인턴 근무 중이라는 내용을 기재했다 연구계획서에는 인턴 경력을 언급하며 인권과 법에 관심을 가지고 있어 석사 과정에서 연구를 이어가고 싶다는 취지의 내용이 있었고 고려대 대학원 자기소개서에는 인턴 근무 경력을 언급하며 입법 정책 등에 대해 배우고자 노력하겠다는 언급도 등장했다 결국 이 인턴확인서는 대학원 입학의 필수제출서류는 아니었지만 필수제출서류에 기재된 내용을 입증하는 중요한 자료로 활용됐다는 뜻이다 정 판사는 이 사건 입시는 필수자격을 갖추기만 하면 합격하는 것이 아니라 여러 요소들을 종합하여 당락이 결정된다 며 특히 경합하는 지원자들 사이에 학업 성적이나 영어 점수에 대한 평가가 크게 차이가 나지 않는 경우 등에는 이러한 인턴 경력 등이 있는 지원자와 없는 지원자 사이에 당락에 영향을 주는 정도가 아니라 상대적으로 더 클 수 있음은 당연하다 고 밝혔다 받아들여지지 않은 공소권 남용 주장1심 재판 과정에서 최 대표는 검찰이 절차를 지키지 않고 공소권을 남용해 자신에 대한 표적수사를 벌였다고 주장했다 검찰개혁에 앞장서고 있는 자신을 검찰이 절차를 제대로 지키지 않고 수사해 선별기소했다는 주장이다 정 판사는 구체적인 주장의 내용 뿐만 아니라 피고인이 군법무관 변호사로서 오랜 기간 법률사무에 종사해왔다는 점에서 납득하기 어려운 주장 이라고 했다 최 대표는 피의자 소환을 요구받지 못해 불이익을 받았다고 했다 정 판사는 2019년 11월19일 서면 진술서를 제출한 이후 수사단계에서 3차례에 걸쳐 출석요구서를 받았지만 불응했다는 점 등을 들어 최 대표가 피의자조사를 받지 못해 유리한 주장이나 증거를 제출하지 못했다고 보기 어렵다 밝혔다 최 대표는 윤석열 검찰총장이 이성윤 서울중앙지검장을 뛰어 넘어 해당 수사팀에 무조건 인사발표하기 전에 오늘 기소하라 는 지시를 한 점도 문제 삼았다 정 판사는 검사는 단독관청으로서 자신의 책임 아래 단독으로 공소를 제기할 권한이 있기 때문에 공소 제기 과정에서상급자 지휘를 따르지 않거나 내부 결제 절차가 준수하지 않는 것이 공소 제기에는 영향을 미치지 않는다고 봤다 정 판사는 검찰총장이 서울중앙지검장이나 서울중앙지검 소속 검사를 직접 지휘했더라도 검찰청법을 위반한 것이라고 볼 수 없다 며 피고인이 수차례 소환장을 받고도 출석하지 않은 점 그 밖에 기소 시점까지 수집된 증거의 입증정도 등에 비추어 검찰총장의 지휘로 피고인에게 어떠한 실질적 불이익이 있었다고 볼 수 없다 고 했다 정 판사는 정 전 교수에게 입학에 필요한 증빙서류를 제공해 허위가 인정된 이들이 더 있는데 유독 자신만 기소됐다며 선별적 기소를 주장한 것에 대해선 검사의 소추재량권을 인정하는 대법원 판례를 근거로 공소시효의 완성 허위서류의 용도에 대한 인식이 다르고 적법한 기소요건을 갖추고 있었다 하더라도 범행 후의 정황 등 기소 제기 여부에 대한 고려항이 모두 다를 수밖에 없다 고 판단했다 유리한 양형요소가 없다 정 판사는 인턴활동 확인서가 최 대표와 조 전 장관의 특수 관계에 따라 발급된 것으로 판단했다 정 판사는 인턴 확인서는 아무 지원자나 마련할 수 있는 게 아니고 피고인 최 대표 과 같이 사회적 지위가 있는 사람과 단순한 친분관계를 넘어 상당한 신뢰관계가 형성되어 있지 않으면 발급받을 수 없는 서류 라며 이 사건의 피해자는 대학원 입학담당자들이지만 궁극적으로 입시 공정성에 대한 신뢰를 훼손하는 행위이고 우리사회에서 학벌이 사회적 지위 등에 미치는 영향이 지대하는 점에서 가볍게 여길 수 없는 범죄 라고 했다 법원의 판결은 일반적으로 사실 관계를 확정하고 각 주장에 대해 살핀 뒤 혐의 사실에 대한 유 무죄 여부를 판단하는 순서로 진행된다 범죄 혐의가 인정되면 선고형을 결정하는 양형 판단을 한다 정 판사는 최 대표에 대해 전과가 없고 인턴 확인서가 입시 결과에 미치는 영향이 논문 허위 작성 등 다른 성과물을 조작하는 것보다 제한적이며 확인서를 발급해 준 뒤 이득을 취한 것이 없다는 것을 유리한 점이라고 봤다 그러나 정 판사는 최 대표에 대해 이런 유형의 업무방해죄에 있어서 행위자의 진지한 반성은 범죄예방의 측면에서도 양형에 상당한 영향을 미치는 요소 라며 피고인에게는 이러한 유리한 양형요소가 없다 고 했다 반성하지 않는 최 대표의 태도를 양형에 참조했다는 뜻이다
159,[사설]개미투자자 불이익 없게 공매도 안전장치 세우고 재개해야,2021. 01. 31,http://news.khan.co.kr/kh_news/khan_art_view.html?artid=202101312050005&code=990101,주식시장의 공매도 재개 여부를 두고 정부 여당의 숙의가 길어지고 있다 당초 공매도는 코로나19 충격에 주가가 급락한 지난해 3월 중단된 뒤 부작용을 막을 제도 보완을 거쳐 오는 3월15일 재개할 예정이었다 그러나 동학개미 로 불리는 개인투자자들이 증시 활황세에 찬물을 끼얹을 수 있다고 반발하자 4월 보궐선거를 앞둔 더불어민주당도 바짝 신경 쓰며 결론을 미루고 있다 지나치게 여론 눈치를 보는 게 아니냐는 비판을 받을 만하다 공매도란 앞으로 주가 하락을 예상해 주식을 일단 증권사에서 빌려서 판 뒤 주가가 내려가면 나중에 사서 갚으며 차익을 얻는 투자기법이다 개인은 기관투자가에 비해 자금력과 정보력이 부족해 하기 어렵다 아예 주식을 빌리지도 않은 채 매도부터 하는 불법 무차입 공매도 까지 횡행한다 이에 공매도를 아예 없애달라는 개인투자자들의 요구도 빗발친다 미국에서도 최근 공매도는 뜨거운 감자가 됐다 대표적으로 게임스톱 이란 게임업체 주가가 비정상적으로 뛰어 헤지펀드들이 공매도에 나서자 개인투자자들이 게임스톱 주식을 사 모으며 단체 대항에 나섰다 결국 주가가 치솟으며 큰손인 헤지펀드는 올 들어 약 22조원이나 손실을 냈다 이를 두고 개미들의 혁명 증시 민주화 라는 평가까지 나온다 미 의회는 증시가 헤지펀드와 그 금융파트너들에 의해 어떻게 조작되는지 살펴보자 며 청문회를 열기로 했다 증시 변동성이 큰 코로나19 시대에 국내에서도 타산지석으로 삼을 만하다 정부 여당은 언제 공매도를 재개할지 원칙에 따라 빨리 결단을 내리는 게 예측 가능한 투자를 위해 바람직하다 공매도는 증시 과열을 막는 순기능도 있다 국제통화기금 IMF 은 지난 28일 한국에 공매도 재개를 권고했다 다만 그에 앞서 기울어진 운동장 부터 바로잡고 공매도 재개에 나서는 게 옳다 금융위원회는 4월부터 불법 무차입 공매도에 대한 처벌 수위를 높이는 자본시장법 시행령 개정을 입법예고했다 과태료만 매기던 데서 징역형 벌금형과 과징금을 부과토록 처벌을 강화하는 방향은 바람직하다 나아가 당국은 공매도 주문을 반드시 전산 처리토록 하는 보완책을 살펴볼 필요가 있다 현재는 주식 차입을 전화 등으로 하는 관행이 있어 악용 소지가 있다 기술적으로 무차입 공매도를 완전히 막기란 어렵지만 불공평한 제도 개선은 계속 해나가야 한다
160,"김종인 ‘북한 원전 지원’ 발언에 청, “터무니없는 주장…법적조치할 것”",2021. 01. 29,http://news.khan.co.kr/kh_news/khan_art_view.html?artid=202101291756001&code=910203,청와대는 29일 정부가 북한에 극비리에 원전을 지어주려했다는 김종인 국민의힘 비상대책위원장의 발언에 대해 터무니없는 주장 이라며 정부는 법적 조치를 포함해 강력히 대응할 것 이라고 밝혔다 강민석 청와대 대변인은 이날 브리핑에서 아무리 선거를 앞두고 있어도 야당 대표의 입에서 나온 말이라고는 도저히 믿겨지지 않는 혹세무민하는 발언 이라며 이같이 말했다 앞서 김 위원장은 월성 원전 1호기 경제성 조작 의혹 사건으로 기소된 산업통상자원부 공무원들의 공소장과 그들이 삭제한 파일 목록을 검토한 후 언론에 배포한 입장문을 통해 대한민국 원전을 폐쇄하고 북한에 극비리에 원전을 지어주려 한 것은 원전 게이트를 넘어 정권의 운명을 흔들 수 있는 충격적인 이적행위 라며 검찰의 추가 수사를 촉구했다 산업부 공무원들이 북한 원전 건설 관련 문건 파일을 삭제한 정황이 검찰 수사 과정을 통해 알려지고 야권의 공세가 거세지자 청와대가 선제적으로 논란을 차단하려는 의도로 보인다 강 대변인은 이에 대해 북풍 공작과도 다를 바 없는 무책임한 발언이며 묵과할 수 없다 면서 김 위원장은 발언에 책임져야 한다 고도 했다 청와대 핵심관계자는 이같은 입장이 문재인 대통령의 지시사항이냐는 기자들의 질문에 청와대 공식입장이다 대통령 뜻과 다를 수 있겠느냐 면서 구체적인 법적 조치에 대해선 지금부터 검토를 해나가야 할 것 이라고 말했다
161,[단독]'라임 피해자 환매 취소' 의혹 대신증권·전 센터장 불기소,2021. 01. 28,http://news.khan.co.kr/kh_news/khan_art_view.html?artid=202101281510001&code=940301,라임자산운용 라임 사모펀드 환매중단 사건 피해자들의 동의 없이 환매 주문을 일방적으로 취소한 혐의로 고소됐던 대신증권과 장모 전 대신증권 센터장에 대해 검찰이 불기소 처분했다 28일 경향신문 취재 결과 서울남부지검 형사6부 부장검사 김락현 은 지난 22일 전자금융거래법 위반 등 혐의로 고소된 대신증권과 장 전 센터장에 대해 혐의없음 으로 불기소 처분을 내렸다 피해자 60여명을 대리하는 법무법인 우리는 지난해 7월 전자금융거래법 위반 등 혐의로 대신증권과 장 전 센터장 등을 남부지검에 고소했다 피해자들은 당시 기자회견에서 2019년 10월2일 환매 신청을 하라는 장 전 센터장의 말을 듣고 환매 신청을 했다 이후 환매 신청이 본인 동의 없이 취소됐다 대신증권이 직무상 알게 된 정보인 고소인들의 트레이딩 시스템 아이디와 비밀번호를 이용해 무단으로 환매 신청 주문을 취소했다 고 주장했다 장 전 센터장은 검찰 조사에서 라임 측에 환매청구를 요청했다 하지만 라임 측이 다른 펀드 가입자들과의 형평성 등을 이유로 환매청구를 승인하지 않아 전산상 취소됐다 대신증권이 임의로 취소한 게 아니다 라고 진술했다 검찰은 불기소 결정서에서 대신증권 측이 당시 고소인들의 동의를 받아 라임 펀드에 대한 환매청구를 했으나 라임 측이 환매청구 승인을 취소했다 이에 따라 한국예탁결제원 전산상으로 환매청구 승인이 취소된 사정이 인정된다 고 했다 검찰은 고소인들의 라임 펀드 환매청구에 대한 전산상 취소는 대신증권 측의 임의적 전산조작에 의한 것이 아니라 라임 측의 환매청구 승인 취소 및 이에 따른 한국예탁결제원의 관련 전산처리 절차에 의한 것임이 확인됐다 피의사실을 인정하기 어렵다 고 밝혔다 한 피해자는 피해자들이 적법하게 환매청구한 전산자료를 피해자들 동의 없이 대신증권 차원에서 취소한 게 맞다 지난해 국정감사에서도 금융감독원장은 권은희 의원 질의에 대신증권이 취소한 것을 인정했다 금감원이 국회에 보냈던 공문에서도 마찬가지였다 명백한 증거를 무시했다 불기소 이유서에 누가 환매를 취소를 한 것인지 주체도 나와있지 않다 며 반발했다 서울남부지법 형사합의12부 재판장 신혁재 는 지난해 12월 라임 펀드를 불완전 판매해 투자자들에게 수천억원대 손실을 입게 한 혐의로 재판에 넘겨진 장 전 센터장에게 징역 2년형을 선고했다 장 전 센터장은 1965억원 상당의 라임 펀드를 불완전 판매한 혐의로 기소됐다
162,"'재일교포 간첩단' 조작사건 고 김승효씨, 뒤늦은 배상 판결",2021. 01. 28,http://news.khan.co.kr/kh_news/khan_art_view.html?artid=202101281901001&code=940100,박정희 정권 시절 재일교포 간첩조작 사건의 피해자 김승효씨와 그 가족에게 국가가 15억여원을 배상하라는 판결이 나왔다 고문 후유증으로 정신병원에 입원하기도 했던 김씨는 지난해 12월26일 일본 교토 자택에서 별세했다 서울중앙지법 민사합의37부 재판장 박석근 는 김씨와 유족 4명이 국가를 상대로 낸 손해배상 청구 소송에서 원고 일부 승소 판결했다 재판부는 피고 대한민국이 김씨에게 12억4900만원 김씨 형제 등 유족에게 모두 3억2800만원을 지급하라고 했다 2020년 10월23일부터 2034년 8월21일까지 생존을 조건 으로 매월 말일 약 211만원씩 지급하라는 주문도 나왔다 고문 후유증을 앓았던 김씨에 대한 개호비 간병비 명목이다 하지만 지난해 70세로 이미 별세한 김씨와 그를 간호해왔던 가족들에겐 공허한 주문이었다 김씨는 1974년 서울대 경영학과에 재학 중 북한의 지령으로 반정부 투쟁을 선동했다 는 조총련 학원침투 간첩단 사건으로 중앙정보부에 끌려갔다 모진 고문이 이어져 스스로 간첩이라는 허위 자백을 했다 법원은 징역 12년을 선고했다 김씨는 1981년 가석방된 뒤 정신착란 증상을 보이는 등 후유증을 앓았고 정신병원에 21년가량 입원했다 간첩 조작 사건을 다룬 다큐멘터리 영화 자백 에 등장해 오랫동안 사용하지 않았던 한국어로 한국은 나쁜나라 라고 말해 관객들에게 깊은 인상을 남겼다 김씨의 형이 2016년 재심을 청구했고 서울고등법원은 2018년 무죄를 선고했다 당시 재판부는 김씨의 한국어 능력과 진술서 작성 과정 등을 볼 때 공소사실을 제대로 이해하지 못하고 불법 구금된 상태에서 허위 자백을 한 것으로 판단했다 이날 김씨에 대한 배상 판결은 삼례 나라슈퍼 사건 의 선고 다음으로 이어서 진행됐다 김씨 측 대리인인 장경욱 변호사는 고문 가혹행위와 정신분열증의 인과관계를 인정했다는 점에선 의미가 있다 면서 다만 김 선생님께서 이미 별세하신 뒤 나온 늦은 판결이라 아쉽다 고 말했다
163,월가 맞선 ‘미국 개미’ 봉기…하락장서 게임스톱 등 수직상승,2021. 01. 28,http://news.khan.co.kr/kh_news/khan_art_view.html?artid=202101282112025&code=970201,CNN 배경에 트럼피즘 공매도 나선 헤지펀드들 큰 손실 월가의 권력이 바뀌었다 27일 현지시간 월스트리트저널 WSJ 은 미국 뉴욕증시에서 개인투자자들이 헤지펀드의 엘리트 분석가들에 대항해 승리를 거두고 있다고 전했다 로빈후드 로 불리는 개인투자자들이 똘똘 뭉쳐 게임스톱 등 특정 종목의 주가를 급등시키면서 공매도에 베팅한 헤지펀드들이 대규모 손실을 떠안았기 때문이다 이날 주요 지수가 일제히 하락한 뉴욕증시에서 일부 종목만 이상 급등 현상을 보이자 미 증권 규제당국인 증권거래위원회 SEC 는 상황을 모니터링 중 이라면서 우려를 표했다 이날 뉴욕증시 다우지수는 전장 대비 633 87포인트 2 05 떨어진 3만303 17을 기록하며 3개월 만에 최대 하락 폭을 보였다 스탠더드앤드푸어스 S P 500 나스닥 지수 등 주요 지수들도 모두 하락세로 전환했다 하지만 게임스톱 AMC 블랙베리 등 일부 종목 주가는 40 200 까지 급등했다 모두 개인투자자들이 공격적으로 투자한 곳이다 특히 게임스톱은 이날 하루 134 84 급등한 347 51달러에 장을 마감했다 게임스톱은 대형마트 등에 입점하는 오프라인 게임매장 기업이다 코로나19 대유행 이후 전망이 어두웠지만 한 달 만에 주가가 19배나 뛰었다 게임스톱 등의 주가 하락을 예상하고 공매도에 나선 헤지펀드들은 큰 손실을 떠안았다 게임스톱으로 재미를 본 개인투자자들은 코로나19로 경영악화에 몰린 극장체인 AMC와 소프트웨어 업체 블랙베리 투자에 나섰다 특별한 호재 없이 주가가 오르자 경영진들은 어리둥절해하고 있다 블랙베리는 이달 들어 주가가 150 넘게 폭등하는 바람에 캐나다 금융 규제 당국에 배경 설명을 요구받았는데 경영진조차 이유를 모르겠다 고 해명했다 로빈후드 개미 군단의 공세에 몰린 헤지펀드사들은 SEC에 조사를 촉구하고 나섰다 SEC는 이날 성명을 통해 투자자 보호와 효율적인 시장 관리를 위해 유관 기관들과 협력하고 있다며 상황을 적극적으로 모니터링 중 이라고 밝혔다 개인투자자들의 봉기를 바라보는 시선은 엇갈린다 알렉산드리아 오카시오 코르테스 민주당 하원의원은 트위터에 경제를 카지노처럼 다뤄온 월가가 역시 시장을 카지노처럼 취급하는 온라인 게시판 활동가들에게 불만을 드러낸 것 이라고 말했다 블룸버그는 월가 주류에 대한 포퓰리즘적 봉기 라는 평가도 있지만 의도적인 시장조작은 더 많은 투자자들에게 손실을 줄 수 있다 고 경고했다 CNN은 트럼피즘이 엘리트에 대한 분노에서 나온 것처럼 월가의 엘리트를 향한 불만이 개인투자자들의 동력이 되고 있다 면서 이제 월가에서 누가 괴물이고 누가 영웅인지는 당신의 관점에 따라 180도 달라진다 고 했다
