,title,date,url,content
49,라임 피해자 진술서 보니...암환자 집까지 찾아와 라임 펀드 팔았다,2021. 03. 08,http://news.khan.co.kr/kh_news/khan_art_view.html?artid=202103081812001&code=940301,라임 무역펀드 피해자 207명 검찰 진술서 분석3 대 예금 해외파생상품 등엉터리 설명 뒤 수수료 1 떼단 1명도 정확한 설명 못 들어실적에 눈 먼 시중은행들한국 금융 미성숙함 보여줘항암치료를 받던 A씨는 2019년 5월 B은행에서 예금이 만기됐다는 안내 전화를 받았다 A씨가 인출 의사를 밝히자 은행 개인자산관리자 PB 는 1년 만기 연 5 를 주는 안전한 상품이 있다 며 라임자산운용의 무역금융펀드 가입을 권유했다 질병 치료에 집중하고 싶다며 거절했으나 PB는 집 앞까지 찾아와 투자계약서에 서명을 받아갔다 두 달 뒤 A씨는 자신이 가입한 펀드의 부실 가능성이 언론에 보도되자 PB에게 전화해 해지를 요청했다 알고 보니 A씨가 가입을 권유받던 시점에 이미 해당 펀드가 미국 다단계 펀드 사기에 엮여 98 의 원금 손실이 예고된 터였다 PB는 B은행이 수탁고라 안전하다 고 둘러댔다 A씨는 검찰에 제출한 진술서에서 제1금융권인 은행이 PB도 제대로 모르는 상품을 팔았어야 했는지 화가 난다 고 했다 8일 경향신문이 라임 무역펀드에 총 1600억원가량을 투자한 피해자 500여명 중 207명이 서울남부지검에 제출한 진술서를 분석한 결과 단 1명도 정확한 상품 설명을 듣지 못한 것으로 나타났다 무역펀드에 대한 구체적 소개가 없었거나 다른 투자 상품으로 설명했다는 응답이 42 원금보장형 예금으로 설명했다는 응답이 27 부실 과장 설명을 했다는 응답이 23 등이었다 라임 무역펀드는 우리은행 판매액 650억원 하나은행 364억원 신한금융투자 425억원 미래에셋대우 91억원 등이 판매했다 이 중 은행들은 무역펀드를 3 대 금리 정기예금 독일 금리와 연계된 파생결합펀드 DLF 삼성 등 국내 기업에 투자하는 상품 으로 설명한 뒤 선취 수수료 명목으로 1 가량을 떼어갔다 주된 판매대상은 투자 경험이 없는 주부와 고령자로 이들은 평생 모은 퇴직금과 전세금 자녀 결혼자금 등을 잃게 됐다 약 1400쪽 분량의 피해자 진술서에 가장 많이 등장하는 단어는 안전 이었다 투자 경험이 전무한 이들이 주로 판매사들에 원금 보장 여부를 질문했기 때문이다 50여년간 고물상을 운영한 C씨는 돈이 모일 때마다 틈틈이 D은행에 들러 예 적금을 했다 한글을 잘 모르는 그는 평소처럼 은행에 들러 예금 계좌를 만들어 달라고 했고 매번 그를 반겼던 PB가 당연히 그렇게 했을 것으로 믿었다 하지만 예금 만기가 돌아와도 돈을 주지 않아 사정을 알아보니 PB가 서류를 조작해 무역펀드에 가입한 것이었다 피해자들 중에는 전직 은행원 등 투자 경험이 있는 사람도 있었다 E증권사를 통해 무역펀드에 가입한 F씨는 투자는 최종적으로 개인이 책임져야 한다는 것에 동의하지만 이번 건은 판매사의 부주의 내지 고의성 있는 사기로 당초 설명과 동일한 투자가 이행되지 않았다 고 말했다 금융당국 관계자는 라임 사태가 확산된 데는 실적에 눈먼 금융사들의 불완전 판매 가 있었다 며 미성숙한 한국 금융기관의 민낯을 보여준 것 이라고 말했다 판매사들은 지난해 6월 금융감독원 분쟁조정위원회의 원금 전액 반환 권고에 따라 절차를 밟고 있다 이들은 우리도 피해자 라며 펀드를 기획한 신한금융투자를 상대로 구상권 청구를 검토 중이다 피해자 G씨는 은행들은 라임에 속았다며 책임을 미루는데 실적과 수수료만 생각해 검증도 안 된 상품을 판 것 이라며 상한 과일을 사도 구입한 가게에서 교환하지 과일농장에서 교환하지 않는데 은행은 구멍가게보다 못한 수준 이라고 말했다
50,"[사설]LH 의혹, 수사역량 총동원해 차명 투기까지 낱낱이 밝혀야",2021. 03. 08,http://news.khan.co.kr/kh_news/khan_art_view.html?artid=202103082057005&code=990101,정부가 한국토지주택공사 LH 직원들의 3기 신도시 투기 의혹 수사를 위해 정부합동특별수사본부를 구성하기로 했다 정세균 국무총리는 남구준 국가수사본부장에게 현재 국가수사본부에 설치된 특별수사단을 국세청 금융위원회 등 관계기관이 참여하는 합동수사본부로 확대 개편해 개발지역에서의 차명거래 등 모든 불법적 탈법적 투기행위에 대해 철저히 수사하라 고 지시했다 정부는 지난주 국무총리실 국토교통부 등이 참여하는 합동조사단을 꾸려 국토부와 지방자치단체 공무원 4000명 LH 직원 1만명의 토지거래 조사에 착수했다 조사단이 수만명에 이르는 대상자의 거래 내용을 파악할 수는 있지만 계좌추적이나 압수수색 등 강제 수사권이 없어 차명 거래와 미등기 전매 등 불법행위 적발에는 한계가 있어 이를 보완한 것이다 투기자 색출과 처벌은 부동산 관련 공직자들의 도덕적 해이를 타파하고 정부 부동산정책의 신뢰 회복을 위한 첫걸음이다 정부는 이번주 안으로 합조단의 1차 조사 결과를 발표하고 국수본에 수사를 의뢰할 계획이다 광명 시흥 지역 투기 외에도 담합을 통한 시세조작 허위거래 신고 후 취소 등 시장교란 행위도 밝히기로 했다 정 총리는 불법과 비리가 밝혀진 공직자와 관련자는 엄중히 처벌하는 것은 물론 수사를 의뢰해 법적으로 죄를 따져 패가망신할 정도로 엄히 다스리겠다 고 말했다 부동산시장의 불공정성을 바로잡는 데 이견이 있을 수 없다 검경 수사권 조정으로 LH 의혹 수사는 검찰이 직접수사하는 이른바 6대 범죄 에 해당하지 않는다 그런데 야권은 이번 사건을 검찰이 수사해야 한다고 주장한다 검찰을 포함해 수사 역량을 총동원해야 한다는 점에서는 의미가 있지만 검찰의 직접수사 여부가 이번 사건의 논점은 아니다 실제 검찰은 이번 수사에서 배제되지도 않았다 수원지검 안산지청은 이미 이번 사건과 관련해 부동산투기 수사전담팀 을 구성했다 금융 경제범죄전담부 형사3부 부장검사를 팀장으로 같은 부 소속 검사 4명으로 이뤄졌다 전담팀은 초동 수사 단계부터 경찰 등 유관 기관과 협력해 법리검토 사례분석 자료를 지원하고 공유할 예정이다 지금은 검경이 조정된 수사권을 안착시켜야 할 시기이다 따라서 이번 사건 수사를 놓고 검경 간 경쟁 구도로 몰아가는 것은 바람직하지 않다 윤석열 전 검찰총장도 불필요한 언급을 자제해야 한다 경찰도 검찰과 적극 협력해야 한다 특히 국수본은 수사 역량을 보여주는 시험대에 올랐음을 명심하고 모든 역량을 집중해 불법행위를 찾아내야 한다
51,"전기차, 배터리 관리만 잘하면 22년 장수한다",2021. 03. 08,http://news.khan.co.kr/kh_news/khan_art_view.html?artid=202103082156005&code=920508,내연기관차와 다른 사용법현대차 아이오닉 5 르노삼성차가 판매 중인 르노 조에 한국지엠이 들여온 쉐보레 볼트 EV 전기차가 쏟아지고 있다 국내 완성차 업체뿐만 아니라 수입차 업체들도 앞다퉈 간판 전기차 모델을 내놓고 전기차 대전 을 준비 중이다 전기차는 소음과 진동이 적고 배출가스를 내뿜지 않지만 구동원리 등이 내연기관 차량과 달라 특성을 제대로 파악해야 안전하고 즐거운 운전을 할 수 있다 전기차 배터리 수명과 안전은 배터리와 구동모터 감속기 완속충전기 등 전기차 전용 부품은 내연기관보다 상대적으로 긴 무상보증 서비스를 해준다 초창기에 있는 전기차 주요 부품 성능이나 안전이 기존 내연기관만큼 검증되지 않았다는 의미다 실제 전기차의 가장 중요한 부품 중 하나인 배터리는 충 방전 여건 주행 습관 등에 따라 수명이 크게 달라진다 급가속이나 급출발 등 거친 운전을 하면 내부 전극 물질의 변형으로 배터리 수명이 줄어든다 험로를 장시간 달릴 경우 배터리에 충격을 주거나 코나 EV처럼 충전 중에 화재가 발생할 가능성도 있다 업계 전문가들은 그러나 화재 등 전기차 사고에 너무 예민하게 반응할 필요는 없다고 조언하고 있다 예컨대 화재 발생원으로 지목받고 있는 고전압 배터리는 다양한 고강도 테스트를 거쳐 안전도를 확인한다는 것이다 전기차용 배터리는 발화 및 폭발 여부를 확인하는 충돌 시험 수분 유입 차단 및 기능 이상 유무를 검증하는 수밀 시험 소금물에 배터리를 침수시켜 발화 및 폭발 여부를 확인하는 침수 시험 배터리를 직접 화염에 노출시켜 폭발 여부를 검증하는 연소 시험 등을 거친다 아이오닉 5에 사용된 E GMP 같은 전용 전기차 플랫폼은 배터리와 모터 차체 구조에 이르기까지 전기차의 특성을 고려한 설계를 바탕으로 하기 때문에 이전 내연기관차를 베이스로 한 모델보다 배터리 보호에 좀 더 유리하고 화재 위험도 낮다고 한다 실제 아이오닉 5의 고전압 배터리 주변은 변형을 방지하기 위해 초고장력강판 사용을 늘리고 예기치 못한 충돌에서 배터리를 보호하기 위해 핫스탬핑 공법도 확대했다 배터리 케이스 후판에도 알루미늄 소재를 적용하고 케이스 중앙부는 차체에 견고하게 연결해 충돌에너지 흡수 효율도 높였다는 게 현대차 측 설명이다 고전압 배터리를 장시간 제 성능을 유지한 채 사용하려면 충전을 자주 해주는 것이 좋다 보통 배터리는 방전과 충전을 반복하면 수명이 줄어들기 때문에 방전과 충전 횟수로 수명을 표시한다 완전 방전된 뒤 100 충전할 경우 약 1000회 50 사용 후 충전하면 약 5000회를 사용할 수 있다 또 20 사용 후 충전을 하면 8000회 정도까지 늘어난다 1회 완충 주행거리가 500 인 전기차라면 배터리의 20 를 사용할 때 100 를 운행할 수 있다 매일 100 를 달린 뒤 충전한다고 가정하면 8000일 약 22년 동안 배터리 교체 없이 탈 수 있다는 계산이 나온다 전기차를 타는 동안 별다른 고장 없이 배터리를 교체할 일은 없다고 봐도 무방한 셈이다 하지만 매번 몇 밖에 달릴 수 없는 상태에서 충전을 하거나 완전 방전될 때까지 방치한다면 배터리 수명은 크게 줄어든다 일반적으로 충전 상태가 최소 20 에서 80 사이일 때 자주 충전해주는 것이 좋다 배터리는 운전하지 않아도 충전량이 줄어들기 때문에 장기간 사용하지 않을 때는 3개월에 한 번씩은 충전해줘야 한다 전기차 주행거리를 늘리려면용량이 큰 배터리를 사용하면 주행거리는 늘어난다 하지만 차량 내부를 모두 배터리로 채울 수는 없기 때문에 완성차 업체들은 정해진 용량의 배터리를 효율적으로 사용하는 데 주력하고 있다 배터리 수명처럼 전기차도 급출발과 급가속을 하면 바퀴를 돌려주는 전기모터가 배터리를 많이 먹어 주행거리가 줄어든다 순간 가속이 내연기관차보다 빠르지만 부드러운 출발과 가속을 하는 것이 주행거리 확보에 유리하다 엔진 역할을 하는 전기모터 다음으로는 히터나 에어컨 등 공조장치가 배터리를 많이 소모시킨다 내연기관 차량과 달리 가동 중 열이 발생하는 엔진이 없어 배터리에 충전된 전기로 히터나 에어컨을 돌려야 하기 때문이다 전기차는 대부분 리튬이온 배터리를 사용하는데 납축전지에 비해 가볍고 에너지 밀도가 높지만 온도에 영향을 많이 받는 단점이 있다 기온이 낮아지면 전자의 움직임이 둔해지고 배터리 내부 저항이 증가해 에너지 효율이 떨어지면서 주행 가능 거리가 줄어드는 것이다 따라서 겨울철에는 배터리 소모가 많은 히터 사용량을 최대한 줄이면 주행거리를 좀 더 확보할 수 있다 히터보다 전기를 덜 먹는 열선 시트를 활용하거나 운전자만 탑승할 때는 난방을 운전자에 집중해주는 운전석 개별 공조 장치를 활성화하는 것도 방법이다 현대차나 기아가 생산한 전기차에는 에코 모드가 있는데 이 버튼을 누르면 회생제동 모드와 공조 강도 등을 차량이 조절해 배터리 소비를 최대한 억제해 준다 충전 중에 예약 공조 기능을 사용해도 배터리를 아낄 수 있다 충전 중에 히터를 가동하면 차량 내부 배터리가 아닌 충전 시설의 전기가 사용된다 전기차는 난방처럼 여름철 열기를 식혀주는 에어컨 컴프레서도 전기로 돌린다 에어컨을 가동시키는 데는 적잖은 전력이 필요해 전기차 주행거리에 많은 영향을 미친다 냉방 설정 온도가 낮을수록 바람 세기가 강할수록 작동시간이 길수록 주행 가능거리는 짧아진다 히터처럼 운전석 방향으로 바람이 집중될 수 있도록 개별 공조 기능을 사용하고 더위를 덜 타는 운전자들은 전기를 덜 먹는 통풍 시트를 작동시키면 에어컨보다 전력 소모를 줄일 수 있다 회생제동시스템도 주행거리 연장에 도움이 된다 회생제동은 간단히 말해 감속할 때 발생하는 운동 에너지를 전기 에너지로 바꾸는 장치다 전기차는 가속페달을 밟다 발을 떼면 내연기관 차량이 엔진 브레이크가 걸린 것처럼 감속이 된다 이때 발전이 되면서 배터리에 충전이 된다 현대차와 기아가 출시한 전기차는 운전대 뒤편 패들 시프트로 감속량 회생제동량 을 조절할 수도 있다 아이오닉 5에 적용된 스마트 회생제동시스템 은 전방의 교통 흐름과 내비게이션 지도 정보를 활용해 차량 스스로 회생제동량을 조절해준다 교통체증이 예상되거나 앞차가 가까울 때는 자동으로 회생제동량을 높여 감속 효과와 발전량을 높이고 교통이 원활할 때는 감속량을 낮춰 효율적인 주행이 가능토록 해준다 이처럼 회생제동량을 조절하면 가속페달 조작만으로 가속과 감속 완전 정지까지 할 수 있는데 이를 원 페달 드라이빙 이라 부른다 처음에는 어색하지만 익숙해지면 브레이크 조작을 덜하고 운전으로 인한 피로도 줄어든다 쓸데없는 가 감속도 피하면서 연비도 살짝 높일 수 있다 전기차만의 특화 기능 V2L이전 전기차들은 외부에서 차량 내부로의 단방향 전기 충전만 가능했다 그러나 아이오닉 5 같은 최근 나온 전기차는 내장된 초강력 배터리로부터 외부 전기제품에 전원 220V 을 공급할 수 있는 V2L Vehicle to Load 기능을 갖고 있다 영국 프리미어리그 EPL 인기 구단 첼시 FC 와 스페인 라 리가 소속 아틀레티코 마드리드 선수들이 아이오닉 5 배터리에서 뽑은 전기로 축구공 발사기와 러닝머신을 작동시키는 광고가 유튜브에 올라와 있는데 실제 이런 기능을 갖춘 전기차라면 야외 캠핑장 등에서 전기밥솥이나 에어프라이어 같은 가전제품을 이용할 수 있다 아이오닉 5 장거리 주행용 모델의 경우 17평형 에어컨과 55인치 TV를 동시에 24시간 이용할 수 있다고 한다 V2L 장치는 가전제품뿐만 아니라 다른 전기차를 충전하는 데도 사용할 수 있다
52,홍남기 “국민께 송구···부동산 등록제 등 도입”,2021. 03. 07,http://news.khan.co.kr/kh_news/khan_art_view.html?artid=202103071237001&code=920301,정부가 한국토지주택공사 LH 직원들의 신도시 투기 의혹과 관련해 부동산 정책 관련자들에 대한 감시와 통제 강화를 위해 부동산 등록제 도입을 검토하겠다고 밝혔다 또 중대한 일탈시 기관 전체의 관리책임을 강화하기로 했다 홍남기 부총리 겸 기획재정부 장관 사진 은 7일 정부서울청사에서 부동산 점검 관계장관회의 직후 발표한 국민께 드리는 말씀 을 통해 이같이 말했다 홍 부총리는 최근 부동산정책을 현장에서 집행하는 가장 공정하고 스스로에게 엄정해야 할 공공기관에서 불미스러운 일이 발생하여 참담한 심정 이라며 경제를 책임지고 공공기관 관리까지 종합하는 책임장관으로서 국민들께 깊은 마음으로 송구하다 면서 고개를 숙였다 홍 부총리는 그러면서 LH 직원 투기의혹에 대한 대응과 관련해 3가지 약속과 실천 사항을 발표했다 그는 부동산 투기가 확인될 경우 수사 의뢰 징계 조치 등 무관용하에 조치하게 될 것 이라고 말했다 홍 부총리는 이어 토지개발 주택업무 관련 부처 기관의 해당직원들은 원칙적으로 일정한 범주 내 토지거래를 제한하고 불가피한 토지거래의 경우에는 신고토록 하겠다 며 이에 더해 내부통제 강화 방안의 하나로 부동산등록제 등 상시 감시할 수 있는 체제의 도입도 검토하겠다 고 말했다 그는 아울러 개인 일탈 동기가 원천적으로 차단되도록 하고 중대한 일탈시 기관 전체의 관리책임을 강화하는 것도 검토하겠다 며 부당하게 얻은 이득은 반드시 환수되도록 하여 다시는 그런 시도가 발붙이지 못하도록 하겠다 고 덧붙였다 그는 구체적인 실천 사항에 대해 83만호를 공급하는 2 4 공급대책을 포함한 주택공급대책은 반드시 일정대로 추진하겠다 고 말했다 4대 시장교란 행위 에 대해서는 발본색원하겠다고도 했다 4대 교란행위는 비공개 및 내부정보를 불법부당하게 활용해 투기하는 행위 부동산 거래질서를 위협하는 담합 등 시세조작 행위 허위매물과 신고가 계약 후 취소 등 불법중개 및 교란 행위 내 집 마련 기회를 빼앗아가는 불법전매 및 부당청약 행위 등이다 홍 부총리는 아울러 3기 신도시와 관련해 투기성이 확인되는 경우 자금출처 탈세 여부 대출규정 준수 여부 등도 조사하겠다 고 말했다
53,"김진욱 처장, 이영주 추천…공수처 인사위 구성 완료",2021. 03. 07,http://news.khan.co.kr/kh_news/khan_art_view.html?artid=202103071601001&code=940301,이번주 인사위 첫 회의 열고검사 선발 원칙 등 정할 듯한명숙 사건은 대검에 이첩김진욱 고위공직자범죄수사처 공수처 장이 7일 처장 몫 인사위원회 위원으로 검사 출신인 이영주 서울대 인권센터 인권상담소장 사진 을 추천하면서 인사위 구성이 마무리됐다 공수처는 이번주 인사위 첫 회의를 열고 검사 인선에 본격 착수한다 김 처장은 이날 공수처 페이스북에 야당에서 지난 5일자로 공수처 인사위원 2명을 추천해 국회 추천 인사위원 4명이 모두 구성됐다 며 처장 추천 인사위원으로 이 소장을 위촉한다 고 밝혔다 김 처장은 이 소장의 이력을 설명하며 수사처 검사 선발 등에 많은 도움을 주실 것으로 기대한다 고 밝혔다 이 소장은 2020년부터 서울대 인권센터 인권상담소장과 성희롱성폭력상담소장을 맡고 있다 그는 서울지검 남부지청 현 서울남부지검 에서 검사 생활을 시작해 2009년 여성 검사로는 처음으로 대검찰청 과장 형사2과장 에 임명됐다 2017년 춘천지검장으로 역대 두번째 여성 검사장으로 발탁됐고 법무연수원 기획부장 사법연수원 부원장을 지냈다 김 처장이 처장 몫 인사위원을 위촉하면서 이날 인사위 구성이 마무리됐다 검사 인선 등을 담당하는 인사위는 처장과 차장 여야 추천 위원 각 2명 처장이 위촉한 위원 1명 등 모두 7명으로 구성된다 공수처 검사 후보자를 심사해 재적 위원의 과반 찬성으로 대통령에게 추천하면 대통령이 임명한다 판사 출신인 처장과 차장 더불어민주당이 추천한 오영중 법무법인 세광 변호사를 제외하면 인사위원 7명 중 4명이 검사 출신이다 민주당은 나기주 법무법인 지유 대표 변호사와 오 변호사를 각각 추천했다 나 변호사는 수원 안산 대구지검 부장검사를 거쳤다 오 변호사는 김경수 경남지사의 댓글조작 공모 혐의 1심 변호를 맡았다 국민의힘은 김영종 법무법인 호민 대표 변호사와 유일준 서울지방변호사회 회장 직무대행을 인사위원으로 추천했다 김 변호사는 2003년 당시 수원지검 검사 시절 고 노무현 전 대통령이 마련한 검사와의 대화 에서 노 전 대통령의 청탁 의혹을 제기했다 2017년 안양지청장을 끝으로 검찰을 떠난 김 변호사는 이듬해 자유한국당 중앙윤리위원장을 지냈다 유 변호사는 수원지검 평택지청장을 지냈으며 박근혜 정부 시절 청와대 공직기강비서관으로 일했다 김 처장은 이번주 인사위 첫 회의를 열고 검사 선발 인사 원칙을 정할 것으로 보인다 인사위에서 검사 선발 절차가 완료되고 사건 이첩 규정 등을 담은 사건 사무 규칙도 마련되면 공수처는 1호 사건 수사에 착수할 여건을 갖추게 된다 공수처는 이날 한명숙 전 국무총리 수사팀의 모해위증 교사 고발 사건을 대검에 이첩했다 공수처는 2일 해당 사건 혐의자인 검사 2명에 대한 고발장을 접수했다며 사건 내용 규모 공소시효 임박 등에 비춰 대검이 수사 공소유지 등을 하는 것이 적절하다고 판단했다 고 밝혔다 앞서 대검은 지난 5일 위증 의혹을 받은 당시 수사팀과 재소자 2명 모두 무혐의 결론을 내렸다
