,title,date,url,content
0,‘대면 복지’ 빈자리 채우는 ‘돌봄 로봇’,2021. 04. 01,http://news.khan.co.kr/kh_news/khan_art_view.html?artid=202104012115005&code=940100,말벗 되고 동화 들려주고 서울 자치구 AI 보급 늘어치매 예방 정보 알림 등 효과에 이용자 96 계속 원해 독거노인에게 약 복용시간을 알려주고 어린이들에게 구연동화를 들려주는 역할을 이제 로봇 이 맡는다 지방자치단체들은 최근 몇년 새 돌봄 교육 등 공공 서비스를 제공하는 인공지능 AI 로봇을 보급하고 있다 지난해 코로나19로 자치단체의 행정 서비스도 대면으로 진행하기 어렵게 되면서 로봇 의 쓰임이 늘어나는 추세다 서울 서초구는 외로움과 불안 등을 겪는 고령층을 위한 돌봄로봇 등 올해 총 88대 5종 의 로봇을 통해 맞춤돌봄을 제공한다고 1일 밝혔다 서초구는 말벗 정보알림 등의 기능이 있는 AI 로봇 보미 와 클로바 다솜 효돌 돌돌이 등 돌봄로봇을 이달 중 50대 다음달 10대를 독거노인 등에게 보급한다 이 로봇들은 대체로 인형 모습을 하고 있고 다정한 말투로 약 복용시간 운동시간 등을 알려준다 또 독거노인의 움직임이 크게 줄어들면 자치구 보호자 등에 긴급메시지를 보내 고립사 예방 기능을 하게 된다 그동안에도 지자체들은 사물인터넷 IOT 을 통해 움직임을 파악해 고립를 예방하는 사업들을 추진했다 돌봄로봇은 단순 움직임 확인을 통한 안전 확인에 그치는 것이 아니라 온라인을 통한 안부 확인이나 정보 제공 메시지 알림 등의 기능이 추가됐다 지자체들은 돌봄로봇의 효능이 크다고 보고 있다 앞서 서울 구로구는 2019년 돌봄로봇 효돌이 와 효순이 225대를 보급했고 지난해 추가로 100대를 도입했다 어린아이와 유사한 모양으로 제작된 효돌 효순이는 부산 광주 등 다른 지자체에서도 보급하고 있는 돌봄로봇이다 구로구가 사업 첫해인 2019년 돌봄로봇 이용자를 대상으로 실시한 조사에서 96 7 가 로봇을 지속적으로 사용하고 싶다 고 응답했다 서울 강동구와 강남 관악 양천 중랑 등 5개구는 서울디지털재단 등과 손잡고 지난해부터 반려로봇 리쿠 를 활용한 사업을 벌이고 있다 리쿠는 작은 휴머노이드로 특별한 조작 없이도 사용자를 바라보고 스스로 행동하며 간단한 대화까지 할 수 있다 이들 지자체는 리쿠를 활용해 지난해는 디지털기기 사용에 취약한 장 노년층을 대상으로 카카오톡 활용 교육 을 진행했고 올해는 어린이집 구연동화 사업으로 서비스를 확대했다 리쿠는 구연동화 선생님이 돼 미운 아기오리 흥부와 놀부 등 아이들에게 친숙한 전래동화를 귀여운 표정과 몸짓으로 생생하게 전달한다 강동구는 40대의 리쿠 중 10대를 올해 구연동화 프로그램에 배정했다 강동구 관계자는 대면 교육이 어려운 때 로봇은 안전한 비대면 교육환경을 만들어준다 고 말했다 서초구는 돌봄뿐만 아니라 치매 예방 교육 등에 투입할 로봇 등 로봇의 종류를 다양화했다 그만큼 지자체가 선택 가능한 로봇 이 많아졌다는 얘기다 이주영 서초구 백세인생팀장은 올해 서초구는 똑같은 돌봄로봇을 일괄적으로 보급하는 것에서 나아가 수요자 맞춤형으로 로봇을 보급하려 한다 고 말했다 이 팀장은 2019년부터 스마트 시니어 사업이 시작됐고 지난해 코로나19로 관련 사업이 온라인으로 전환되면서 로봇 수요도 크게 늘었다 면서 사람이 직접 돌보면 좋겠지만 인력도 예산도 부족하고 대면 서비스가 어렵기 때문에 로봇이 보완해주는 부분이 있다 고 말했다
1,보수 야당도 독려·투표율 의미 약화…달라진 ‘사전투표 공식’,2021. 04. 01,http://news.khan.co.kr/kh_news/khan_art_view.html?artid=202104012058015&code=910402,여당 4050 응집력 발휘 기대 야당은 2030에 공들여전문가 점점 분산 투표 성격 강해져 승패 영향력 줄어 4 7 재 보궐 선거 사전투표가 2일부터 이틀간 실시된다 사전투표는 진보진영에 유리하다 는 게 여의도 정치권의 통설이었다 그러나 이번엔 사전투표를 대하는 여야의 판단과 전략이 과거와 확연히 달라졌다 여야 모두 사전투표를 독려하면서도 각자 사전투표소로 끌어내려는 표심은 동상이몽 이다 더불어민주당은 4050 전통적 지지층의 충성표를 최대한 확보하겠다는 계획이고 국민의힘은 박원순 전 시장 성추행과 한국토지주택공사 LH 사태 등으로 반여권 정서가 커진 2030 세대를 사전투표소로 이끌어내겠다는 구상이다 민주당과 국민의힘은 1일 너도나도 사전투표 독려에 나섰다 민주당 의원들의 사회관계망서비스 SNS 에는 사전투표하고 일해요 게시물이 잇따라 올라왔다 국민의힘 중앙선거대책위원회도 사전투표 서울을 바꾸는 힘 2일엔 사전투표 등 문구가 적힌 손팻말을 들고 퍼포먼스를 했다 특히 이번 선거에서는 이례적으로 국민의힘이 사전투표에 공을 들이고 있다 각종 여론조사에서 20대의 정권심판 정서가 확인된 만큼 사전투표율이 높은 20대 유권자들을 실제 투표소까지 가도록 하겠다는 게 국민의힘 구상이다 보수진영 일각에서 지난해 사전투표 조작설 을 제기하며 의심하기도 하지만 오세훈 국민의힘 서울시장 후보는 이날 유세에서 대한민국 투표 시스템을 믿어달라 사전투표에 많이 참여해달라 고 호소했다 민주당은 정반대의 계산을 하고 있다 범진보 청년 유권자들에게 사전투표를 적극 권하던 과거와 달리 이번에는 40 50대에 초점을 맞췄다 이해찬 전 민주당 대표는 TBS 라디오에서 우리 지지층이 강한 데가 대개 40 50대 중반까지다 그분들이 어느 정도 사전투표를 하는가를 보면 선거 결과가 짐작이 갈 것 이라고 말했다 당 관계자는 사전투표를 먼저 한 4050 지지층이 아버지 60 70대 와 자녀 20 30대 세대에 영향을 줄 수 있다 고 설명했다 지지층의 응집력 이 사전투표에서 발휘될 것이라는 기대감이 깔려 있다 여야 모두 사전투표를 통해 자신들에게 우호적인 유권자들의 득표를 이끌어내 기선을 제압하겠다는 전략인 셈이다 그러나 사전투표율 자체가 이제는 큰 의미 없다 는 시각도 있다 전국 단위의 사전투표가 처음 시행된 2014년 6회 지방선거 당시 전체 사전투표자 중 20대 비율은 22 로 모든 연령대 중 가장 높았다 지난해 21대 총선에서 이 비율은 14 6 로 떨어졌다 20대가 사전투표에 많이 참여한다는 공식도 옛말 이라는 것이다 2014년 지방선거 당시 50대 이상에서는 10 안팎의 사전투표율을 보였지만 지난해 총선에선 50대 29 8 60대 33 4 등 장 노년층도 활발히 사전투표에 나섰다 사전투표는 일종의 편리한 투표 방식일 뿐 특정 지지층의 결집 양상을 읽어내기에는 무리가 있다는 뜻이다 이는 특히 코로나19 사태를 거치면서 더 심화됐다는 평가다 엄경영 시대정신연구소장은 통화에서 최근 사전투표 동향은 문자 그대로 미리 투표하는 분산투표 성격이 강하다 며 승패에 절대적인 영향을 미치지는 않을 것 이라고 말했다
2,'영끌' 해서라도 사고 싶다... 제네시스 전기차 기반 GT 콘셉트카 '엑스',2021. 03. 31,http://news.khan.co.kr/kh_news/khan_art_view.html?artid=202103311003001&code=920508,현대차 프리미엄 브랜드 제네시스가 31일 전기차 기반의 GT 콘셉트카인 제네시스 엑스 Genesis X 를 글로벌 온라인 채널을 통해 공개했다 제네시스 엑스는 뉴욕 콘셉트 GV80콘셉트 에센시아 콘셉트 민트 콘셉트에 이은 제네시스의 다섯번째 콘셉트카로 향후 제네시스의 고성능 전기차 디자인을 엿볼 수 있다 제네시스 엑스는 제네시스를 상징하는 두 줄 디자인을 극대화한 것이 가장 큰 특징이다 차량 내부와 외부를 비롯해 전기 충전구에도 두 줄 디자인을 적용했다 앞모습은 방패 모양의 크레스트 그릴과 휠 아치를 관통하는 두 줄 전조등을 배치했다 후드와 펜더를 하나의 패널로 구성한 클램쉘 후드 를 적용 패널 간 단차를 없애고 정교한 이미지를 구현했다 하단 공기 흡입구는 얇고 정교한 그물망 형태로 디자인돼 견고한 느낌을 주며 공기저항을 줄여 주행거리 연장에도 도움이 된다 측면은 긴 보닛과 짧은 트렁크로 이뤄진 전통적인 투 도어 GT 차량 디자인을 따랐다 뒷 펜더는 볼륨을 극대화해 역동적이고 고급스러운 분위기를 연출했다 사이드미러는 디지털 방식을 채택했다 휠은 5 스포크가 적용됐으며 브레이크 캘리퍼는 라임 엑센트 컬러로 포인트를 줬다 뒷모습은 전조등과 같은 두 줄 디자인이 반영된 후미등으로 앞모습과 통일감을 갖게 했다 디퓨저에도 두 줄 디자인 요소를 반영했다 실내는 모든 조작계와 디스플레이가 운전자를 감싸는 칵핏 형태로 만들어졌다 운전석과 동승석 시트 등의 색상을 달리하는 방법으로 공간을 분리했다 계기반 클러스터 내비게이션 공조 장치 등 다양한 기능을 조작할 수 있는 프리폼 디스플레이 와 운전 모드 설정이 가능한 공 모양의 전자식 변속기 SBW 크리스탈 스피어 로 감성적인 실내 분위기도 연출했다 고성능 GT카답게 제네시스 엑스는 버킷 시트와 4점식 안전벨트를 장착한다 제네시스 엑스는 제네시스 디지털 모터쇼 웹사이트 http digitalmotorshow genesis com 에서 볼 수 있다
3,‘정규리그 우승’ 전창진 감독 “날 선택해준 KCC에 보답하고 싶었다”,2021. 03. 31,http://news.khan.co.kr/kh_news/khan_art_view.html?artid=202103312226015&code=980300,개인통산 다섯번째 우승 대기록 위기 많았지만 똘똘 뭉쳐 극복이런 기회 다시 올까 싶었는데아직 담담하지만 정말 기분 좋아 호랑이 감독에서 소통 명장으로파란만장한 농구 인생에 또 하나의 획을 그었다 프로농구 감독으로서 거머쥔 개인통산 다섯 번째 정규리그 우승 들뜰 법도 했지만 전창진 KCC 감독 58 사진 의 목소리는 차분했다 지난 30일 전 감독이 이끄는 KCC는 5년 만에 정규리그 1위를 차지했다 전창진 감독은 31일 기자와 전화인터뷰에서 아직까지는 담담하다 면서도 이런 기회가 다시 올 거라고 생각하지 못했는데 우승을 해 정말 기분이 좋다 고 말했다 전 감독에게 이번 우승은 그 어느 때보다도 특별하다 그 역시 이번만큼은 감회가 남다르다 고 했다 한동안 그의 발목을 잡았던 불법 스포츠도박과 승부조작 혐의에서 벗어나 2019 2020시즌 KCC의 사령탑으로 돌아온 뒤 거둔 첫 우승이기 때문이다 이번 시즌 개막 전 다수의 전문가들이 KCC를 6강 후보 정도로만 예상했지만 이 같은 전망을 보기좋게 뒤집고 정규리그를 제패했다 KCC는 저한테 정말 감사한 팀이죠 힘든 상황에서 저를 선택해 준 만큼 그 빚을 갚고 싶은 마음이 제일 컸던 것 같아요 선택해 주신 만큼 보답해야겠다는 생각이 강했어요 전 감독은 시즌을 치르면서 우승 할 수 있겠다는 생각을 갖게 됐다 며 무엇보다도 비시즌 중 선수들이 잘 따라줬고 열심히 훈련하면서 자신감을 얻을 수 있었다 고 말했다 위기가 없었던 것은 아니다 하지만 선수들이 똘똘 뭉쳐 이를 극복해냈다 시즌 초반 라건아가 다쳤을 때 1라운드를 5승4패로 마치며 선방했고 시즌 중반까지 팀의 승리에 큰 공헌을 해준 타일러 데이비스의 이탈에도 흔들리지 않았다 전 감독은 중간중간에 조금씩 위기는 있었지만 국내 선수들이 중심을 잡아줘서 그런 상황들을 잘 넘긴 게 우승의 원동력 아닌가 생각된다 고 말했다 하지만 기본부터 탄탄하게 다진 여름 훈련과 전 감독을 믿고 따라준 선수들 여기에 선수들과의 원활한 소통이 힘이 됐다 전 감독도 예전 같으면 자신이 일일이 챙기고 끌고 나가야 됐던 것들을 코치와 선수들에게 믿고 맡겼다 시대가 변하면서 선수들의 자세와 농구에 임하는 태도도 달라졌어요 예전 같으면 저 혼자 끌고 가는 부분이 많았는데 이젠 그런 것들이 잘 안 되더라고요 그래서 코치들에게 많은 역할을 주문했고 주장인 이 정현이와도 훈련과 스케줄 등을 상의했어요 선수뿐 아니라 전 감독 자신도 달라졌다 TG삼보 감독 시절 선수들에게 워낙 엄하게 대해 치악산 호랑이 란 별명이 붙을 정도였지만 지금은 선수들이 납득하고 이해할 수 있는 쪽으로 많은 대화를 나누는 편 이라고 했다 전 감독은 올 시즌을 돌아보며 지난 1월 정상영 KCC 명예회장이 타계한 것이 가장 마음 아픈 일 이라고 말했다 우승하는 장면을 명예회장님이 보셨어야 하는데 그렇지 못하고 돌아가셔서 가장 안타깝다 고도 했다 정규리그 우승을 확정했지만 전 감독에게는 통합우승이란 더 큰 목표가 앞에 놓여 있다 어떻게 준비할 계획이냐 는 질문에 전 감독은 이미 훈련 스케줄을 다 짜 놓았다 준비는 마쳤다 며 상대 전력 분석과 선수들의 컨디션을 유지시키는 게 가장 중요하다 고 말했다
4,"감사원, 공공기관 고객만족도 조사 조작 등 마사회 불법행위 확인",2021. 03. 30,http://news.khan.co.kr/kh_news/khan_art_view.html?artid=202103301400001&code=940100,한국마사회가 공공기관 고객만족도 PCSI 조사를 조작하는 등 불법행위를 저질렀다는 의혹 일부가 감사원 감사에서 사실로 확인됐다 감사원은 30일 한국마사회 기관 정기감사 감사보고서에서 마사회의 업무상 위법 부당행위 9건을 확인했다고 밝혔다 이는 지난해 6월3일부터 7월24일까지 실지 감사를 실시한 결과다 이번 감사는 지난해 2월 한국마사회 고 문중원 기수 죽음의 진상규명과 책임자 처벌을 위한 시민대책위원회 현 한국마사회 적폐청산을 위한 대책위원회 가 마사회 불법 부패행위 관련 공익감사를 청구해 이뤄졌다 감사원은 공익감사 청구 내용을 정기감사에 포함해 진행했다 시민대책위는 마사회가 교차수신 타 경마장에서 실시하는 경주를 화상으로 전송받아 발매 관람하는 경주 비율 자료를 허위로 제공하고 외국인 인공지능 AI 도박단에 특혜를 줬으며 공공기관 고객만족도를 조작하고 홍보 자문료 등 운영비를 부적절하게 썼다는 의혹을 제기했다 감사 결과 고객만족도 조작 등 의혹이 사실로 확인됐다 보고서를 보면 마사회는 2016 2018년 고객만족도 조사를 앞두고 직원 가족 등 자사 서비스에 우호적인 고객을 섭외해 조사 표본에 들어가도록 하는 등 수법을 담아 조사대응 지침을 작성했다 이런 꼼수를 3개 지역본부를 포함한 마사회 32개 지사에서 조사담당자 대상으로 교육했다 각 지사 대상 e메일을 보내면서 우호 고객을 조사원 동선에 배치하는 등 구체적 지시도 담았다 동원된 고객에게는 마유 말기름 비누 등 기념품을 줬다 조사가 끝난 뒤엔 PCSI 조사 응답자 확인전화 응대 요령 을 전달해 동원된 고객이 마치 임의로 선정된 것으로 보이도록 꾸몄다 고객만족도 조작을 위해 개인정보를 무단 사용한 사실도 드러났다 보고서는 마사회 본부가 먼저 조사를 받은 지사를 상대로 암행 나온 감독관의 모습을 폐쇄회로 CC TV 화면에서 캡쳐한 뒤 조사를 앞둔 다른 사업장에 공유하도록 지시한 정황을 담았다 2017 2018년 총 10개 지사가 조사원과 감독관 당사자의 동의 없이 CCTV 화면을 캡쳐하는 데 연루됐다 조사의 공정성 제고를 위해 실사업체 및 조사 일정을 미공개하는 기획재정부 방침에 역행하는 조사 태도다 감사원은 보고서에서 마사회는 우호 고객이 조사를 받도록 유도해 부당하게 높은 평가점수를 받는 등 방식으로 2016년부터 2018년까지 3년 간 S등급 최고등급 을 획득했다 고 적시했다 또 각 지사에 설치된 CCTV에 촬영된 조사원과 감독관의 사진을 수집 공유해 고객만족도 조사 대응업무에 활용했다 며 고객만족도 관련 문서를 유출한 직원에 대해 징계요구 및 수사요청을 했다 고 적었다 외국인에게만 마권 구매 편익을 제공했다는 의혹도 감사원은 사실로 판단했다 조사 결과 경마에서 마권 발매액 대비 환급금 베팅에서 승자를 맞춘 사람에게 지급하는 돈 의 비율이 내국인은 72 4 인데 비해 외국인은 121 6 였다 외국인들은 경마에서 내국인보다 돈을 따기 쉬웠다는 뜻이다 감사원은 이 비대칭의 원인이 외국인에 유리한 베팅 구조에 있다고 봤다 베팅 마감에 임박해 마권을 구매할수록 경기의 실제 배당률과 근접한 수치를 확인하면서 돈을 걸 수 있는데 외국인 장외발매소에는 특별히 전담 발매직원이 배치돼 마감 5분 이내 베팅하기가 내국인보다 쉬웠다 또 1인당 10만원 이내로 마권 구매 한도가 정해진 내국인과 달리 외국인들은 마권 구매한도가 없어 분산 베팅을 하기도 용이했다 감사원은 감사 결과를 토대로 기재부 등에 총 9건의 감사결과를 통보했다 기재부에는 마사회의 공공기관 고객만족도 조사 부당 대응과 관련해 주간사업자를 제재하고 마사회 경영평가 점수를 조정하도록 통보했다 마사회 회장에게는 고객만족도 조사 대응업무를 위법 부당하게 처리한 관련자를 문책하도록 요구했다
5,"[단독]감사원, 마사회 공익제보자 직위해제 부당 판단…제보자 “사측 압박 진행형”",2021. 03. 30,http://news.khan.co.kr/kh_news/khan_art_view.html?artid=202103301447001&code=940100,감사원이 30일 발표한 한국마사회 감사 결과에는 마사회가 사측의 부정행위를 언론에 제보한 직원을 상대로 부당한 인사 조치를 내렸다는 판단도 담겨 있다 제보 내용인 사측의 불법 고객만족도 조사 현황 등이 투명하게 알려졌다면 해당 직원이 직위해제 처분 등으로 불이익을 받지 않아도 됐다는 것이다 현재 마사회는 해당 직원에 대한 인사 조치를 취소하라고 한 국민권익위원회를 상대로 행정소송 중이다 감사원의 한국마사회 감사보고서 에 따르면 마사회는 자사의 불법 공공기관 고객만족도 PCSI 조사 의혹을 언론에 제보하고 관련 문서를 유출했다는 이유로 김정구씨를 징계위원회에 회부했다 김씨는 2019년 1월 마사회 제주지역본부 고객안전부장으로 발령받은 뒤 윗선 으로부터 기획재정부 공공기관 고객만족도 조사에 철저히 대응하라 는 지시와 우호 고객을 확보하라는 문서를 전달받았다 김씨는 고객만족도 조사가 무작위로 표본을 선정한 뒤 진행돼야 하는데 회사가 원칙을 어겼다고 판단해 그해 4월 이 같은 내용을 언론에 제보했다 제보 이후 마사회는 2019년 11월과 2020년 2월 김씨의 징계위원회를 개최했다 사측은 김씨에 대한 징계 의결은 유보했지만 부장 보직에서 해제하는 인사 조치를 취했다 급기야 공공기록물관리법 위반과 사문서 위조 행사 등의 혐의로 경찰에 고소까지 했다 감사원은 마사회 징계위가 김씨의 제보와 관련된 사실관계를 충분히 파악하지 못한 상태에서 징계 심사를 진행했다고 판단했다 인사 부서에서 고객만족도 조사 관련 e메일 등 김씨의 주장에 부합하는 자료를 확보하고도 징계위에 알리지 않았다는 것이다 감사원 조사 결과 오히려 인사 부서는 사측에 유리한 언론 보도가 사실과 다르다 는 내용의 참고자료를 제출한 것으로 나타났다 징계위원 중 한 명은 뒤늦게 e메일 내용을 열람한 뒤 감사원에 징계위 당시 이를 알았더라면 그의 제보가 공익성이 인정되는 부분이 있으므로 양형 판단에 영향을 미쳤을 것 이라고 감사원에 밝혔다 마사회가 감사원에 낸 징계위 녹취록에도 징계위원들이 제보 내용이 사실무근인지 아니면 의심할 수 있는 수준인지 궁금하다 거나 고객만족도 조사 대상자를 특정하고 마사회가 이를 관리했다면 공익제보 대상 이라고 의견을 표출한 대목이 남아 있다 권익위는 지난해 6월 마사회에 김씨의 직위해제 처분을 취소하라고 요구했다 마사회는 직위해제 처분을 취소하고 삭감된 임금을 소급해 지급한다는 내용이 담긴 요구사항 이행 결과를 권익위에 통보했다 마사회는 권익위 결정을 일단 수용하지만 사법기관의 판단을 다시 구해보겠다며 권익위를 상대로 행정소송을 제기한 상태다 김씨는 이날 기자와 통화하면서 감사원 보고서를 보면 고객만족도 조사 조작 지침과 교육을 받은 지사가 수십 개에 달한다 하지만 감사원 감사 이전에 마사회 자체 조사에서는 불법행위가 드러나지 않았다 직원들이 두려웠는지 내부 제보를 하지 않은 것 이라고 말했다 이어 감사원 판단이 나왔지만 공익제보자를 향한 마사회 압박은 현재진행형 이라면서 제보자를 끝까지 처단하려는 마사회에게 내가 진다면 앞으로 누가 내부제보를 하겠느냐 라고 했다
6,"김준형 ""한미관계 가스라이팅 상태…동맹중독도""",2021. 03. 30,http://news.khan.co.kr/kh_news/khan_art_view.html?artid=202103301449001&code=910302,김준형 국립외교원장이 30일 펴낸 저서에서 한 미동맹에 대한 과도한 의존을 가스라이팅 상태 나 동맹중독 으로 비유해 논란이 예상된다 김 원장은 이날 영원한 동맹이라는 역설 창비 출간을 기념해 열린 온라인 기자간담회에서 한국은 오랜 시간 불균형한 한미관계를 유지하느라 애쓴 탓에 합리적 판단을 할 힘을 잃었다 미국과 밀당도 해야 한다 고 말했다 그는 한미동맹은 더할 수 없는 우리의 자산 이라면서도 이 관계가 상식적 실용적 합리적 판단을 못 하게 할 정도로 신화화 했다 면서 이같이 말했다 그는 특히 책에서 자국의 국익을 우선시하는 미국의 태도 앞에서 주권국이라면 응당 취해야 할 대응을 하지 못하는 경우도 허다하다 며 이러한 한국의 관성을 일방적인 한미관계에서 초래된 가스라이팅 상태 라고 진단했다 가스라이팅은 타인의 심리나 상황을 교묘하게 조작해 그 사람이 스스로 의심하게 만듦으로써 타인에 대한 지배력을 강화하는 행위 를 뜻하는 용어다 정부 차관급 인사가 한 미관계를 데이트폭력 용어인 가스라이팅 에 비유한 것을 놓고는 적절성 논란이 제기될 것으로 보인다 김 원장은 이날 이같은 표현을 사용한 데 대해 미국이 그렇게 조직적으로 가스라이팅하진 않더라도 할 말을 못한다든지 호혜적 동맹이라면 안할 말은 있어도 못할 말은 없어야 하는데 못할 말이 많았다 미국이 압도하는 경우가 많았다 고 설명했다 김 원장은 미국 주도의 대중 포위망 구상으로 알려진 쿼드 Quad 에 한국의 참여 여부를 묻는 질문에는 방향성이 어디로 갈 지 모르고 내부적으로 이해관계도 있는데 참여할 건 아니다 며 특히 중국을 겨냥한 군사동맹으로 발전할 경우는 더더욱 참여해서는 안 된다 고 말했다 그는 미 중 전략 경쟁이 2 30년은 지속될 것으로 내다보며 최악의 상황은 미중 사이가 더 나빠지고 남북이 나빠져서 북중러 한미일 진영이 나눠지는 것 이라며 우리가 결국 안보 때문에 미국을 일방적으로 선택하지 않는 것이 중요하다 고 말했다 책은 한 미관계 150년사 특히 한 미 군사동맹의 과거와 현재를 조명하는 데 초점을 맞추고 전시작전통제권 전환 사드 배치 미중 전략경쟁 남북미 대화 등의 현안도 다루고 있다
